<?xml version="1.0" encoding="UTF-8"?>
<!DOCTYPE Strings SYSTEM "XfireSkin.dtd">

<Strings lang="en">
    <String Name="AdjustMicSensitivityTip" ResourceID="1073" />
    <String Name="AdjustMicSensitivyText" ResourceID="1073" />
    <String Name="AdjustMicVolumeText" ResourceID="1345" />
    <String Name="AdjustMicVolumeTip" ResourceID="1072" />
    <String Name="AdjustSpeakerVolumeText" ResourceID="1071" />
    <String Name="AdjustSpeakerVolumeTip" ResourceID="1071" />
    <String Name="AlertOptionsTitle" ResourceID="1278" />
    <String Name="AlwaysShowAlertText" ResourceID="1280" />
    <String Name="ButtonAddFriendTip" ResourceID="221" />
    <String Name="ButtonAddServersTip" ResourceID="265" />
    <String Name="ButtonAnswerCallTip" ResourceID="523" />
    <String Name="ButtonCallDisabledTip" ResourceID="746" />
    <String Name="ButtonCallTip" ResourceID="522" />
    <String Name="ButtonCancelCallTip" ResourceID="1104" />
    <String Name="ButtonChatFriendDisabledTip" ResourceID="423" />
    <String Name="ButtonChatFriendTip" ResourceID="222" />
    <String Name="ButtonChatRoomsTabTip" ResourceID="1289" />
    <String Name="ButtonCloseChatTip" ResourceID="1059" />
    <String Name="ButtonCloseDisabledTip" ResourceID="236" />
    <String Name="ButtonCloseTip" ResourceID="236" />
    <String Name="ButtonCreateChatRoomTip" ResourceID="1128" />
    <String Name="ButtonDeleteChatRoomTip" ResourceID="867" />
    <String Name="ButtonDeleteFilesDisabledTip" ResourceID="867" />
    <String Name="ButtonDeleteFilesTip" ResourceID="867" />
    <String Name="ButtonEnterChatRoomDisabledTip" ResourceID="1129" />
    <String Name="ButtonEnterChatRoomTip" ResourceID="1129" />
    <String Name="ButtonExpandInfoTip" ResourceID="232" />
    <String Name="ButtonFilesTabTip" ResourceID="288" />
    <String Name="ButtonFriendInfoDisabledTip" ResourceID="226" />
    <String Name="ButtonFriendInfoTip" ResourceID="226" />
    <String Name="ButtonFriendsTabTip" ResourceID="1065" />
    <String Name="ButtonGroupHostGameLobbyTip" ResourceID="768" />
    <String Name="ButtonGroupHostVoiceChatDisabledTip" ResourceID="746" />
    <String Name="ButtonGroupHostVoiceChatTip" ResourceID="744" />
    <String Name="ButtonGroupJoinVoiceChatTip" ResourceID="639" />
    <String Name="ButtonGroupLaunchGameLobbyTip" ResourceID="769" />
    <String Name="ButtonGroupLeaveGameLobbyTip" ResourceID="767" />
    <String Name="ButtonGroupLeaveVoiceChatTip" ResourceID="745" />
    <String Name="ButtonInfoPicturesTip" ResourceID="226" />
    <String Name="ButtonInviteUsersTip" ResourceID="798" />
    <String Name="ButtonJoinGameDisabledTip" ResourceID="393" />
    <String Name="ButtonJoinGameServersDisabledTip" ResourceID="147" />
    <String Name="ButtonJoinGameServersTip" ResourceID="147" />
    <String Name="ButtonJoinGameTip" ResourceID="224" />
    <String Name="ButtonLeaveCallTip" ResourceID="782" />
    <String Name="ButtonMaximizeTip" ResourceID="270" />
    <String Name="ButtonMaximizeDisabledTip" ResourceID="270" />
    <String Name="ButtonMinimizeDisabledTip" ResourceID="234" />
    <String Name="ButtonMinimizeTip" ResourceID="234" />
    <String Name="ButtonMuteMicDisabledTip" ResourceID="1283" />
    <String Name="ButtonMuteMicTip" ResourceID="524" />
    <String Name="ButtonNotificationsTabTip" ResourceID="1353" />
    <String Name="ButtonOpenFilesDisabledTip" ResourceID="322" />
    <String Name="ButtonOpenFilesTip" ResourceID="322" />
    <String Name="ButtonRefreshServersDisabledTip" ResourceID="263" />
    <String Name="ButtonRefreshServersTip" ResourceID="263" />
    <String Name="ButtonRetractInfoTip" ResourceID="233" />
    <String Name="ButtonScreenShotsTabTip" ResourceID="534" />
    <String Name="ButtonSearchFilesDisabledTip" ResourceID="390" />
    <String Name="ButtonSearchFilesTip" ResourceID="390" />
    <String Name="ButtonSearchVideosTip" ResourceID="1208" />
    <String Name="ButtonSendChatTip" ResourceID="435" />
    <String Name="ButtonServersTabTip" ResourceID="245" />
    <String Name="ButtonUnmuteMicTip" ResourceID="1407" />
    <String Name="ButtonUploadPicturesDisabledTip" ResourceID="1130" />
    <String Name="ButtonUploadTip" ResourceID="1130" />
    <String Name="ButtonUploadVideosDisabledTip" ResourceID="1130" />
    <String Name="ButtonVideosTabTip" ResourceID="1081" />
    <String Name="DisplayAlertOverlay" ResourceID="1074" />
    <String Name="DisplayBrowserOverlay" ResourceID="1231" />
    <String Name="DisplayClockOverlay" ResourceID="1075" />
    <String Name="DisplayDurationText" ResourceID="1281" />
    <String Name="DisplayDurationText" ResourceID="1281" />
    <String Name="DisplayFPSOverlay" ResourceID="1076" />
    <String Name="DisplayVoiceOverlay" ResourceID="1246" />
    <String Name="DisplayWebCamOverlay" ResourceID="1330" />
    <String Name="GCActionsMenu" ResourceID="436" />
    <String Name="GroupChatTitle" ResourceID="440" />
    <String Name="HelpMenu" ResourceID="231" />
    <String Name="ToolsMenu" ResourceID="229" />
    <String Name="TypingMessage" ResourceID="318" />
    <String Name="UserNameText" ResourceID="227" />
    <String Name="XIGAddFriendTitle" ResourceID="221" />
    <String Name="XIGAdjustOpacityTip" ResourceID="1056" />
    <String Name="XIGAllChatsView" ResourceID="1035" />
    <String Name="XIGBroadcastMicrophone" ResourceID="1351" />
    <String Name="XIGButtonCancelTip" ResourceID="201" />
    <String Name="XIGButtonChatsTabTip" ResourceID="1066" />
    <String Name="XIGButtonHelpTabTip" ResourceID="1064" />
    <String Name="XIGButtonOkTip" ResourceId="202" />
    <String Name="XIGButtonVoiceOptionsTabTip" ResourceID="1080" />
    <String Name="XIGChatRoomsTitle" ResourceID="452" />
    <String Name="XIGChatsTitle" ResourceID="1036" />
    <String Name="XIGEditModeOptionsTitle" ResourceID="1279" />
    <String Name="XIGFPSText" ResourceID="1077" />
    <String Name="XIGFriendsTitle" ResourceID="244" />
    <String Name="XIGHelpTitle" ResourceID="347" />
    <String Name="XIGMusicButtonMuteTip" ResourceID="1345" />
    <String Name="XIGOptionsTitle" ResourceID="1152" />
    <String Name="XIGRecordLiveVideoText" ResourceID="1331" />
    <String Name="XIGRoomInviteInstructions" ResourceID="1088" />
    <String Name="XIGRoomInviteTitle" ResourceID="798" />
    <String Name="XIGVoiceOptionsTip" ResourceID="1290" />
    <String Name="XIGWebButtonBackTip" ResourceID="1237" />
    <String Name="XIGWebButtonForwardTip" ResourceID="1236" />
    <String Name="XIGWebButtonHomeTip" ResourceID="1063" />
    <String Name="XIGWebButtonNewTabTip" ResourceID="1241" />
    <String Name="XIGWebButtonRefreshTip" ResourceID="1235" />
    <String Name="XIGWebSearchEditTip" ResourceID="1233" />
    <String Name="XfireMenu" ResourceID="228" />
    <String Name="XfireUsernameText" ResourceID="391" />
</Strings>