<?xml version="1.0" encoding="UTF-8"?>
<!DOCTYPE SkinDescription SYSTEM "XfireSkin.dtd">

<SkinDescription>
    <Author Type="Original">Xfire, Inc.</Author>
    <Author Type="Contributor">Xfire, Inc.</Author>
    <Website>http://www.xfire.com/</Website>
    <Name>Symbiosis</Name>
    <LongName>Symbiosis</LongName>
    <Version>1.0</Version>
    <CompatibleVersion>1.58</CompatibleVersion>
</SkinDescription>
